ID,Year,Problem Number,Question,Answer,Part
2020-I-1,2020,1,"In $\triangle ABC$ with $AB=AC,$ point $D$ lies strictly between $A$ and $C$ on side $\overline{AC},$ and point $E$ lies strictly between $A$ and $B$ on side $\overline{AB}$ such that $AE=ED=DB=BC.$ The degree measure of $\angle ABC$ is $\tfrac{m}{n},$ where $m$ and $n$ are relatively prime positive integers. Find $m+n.$ ",547,I
2020-I-2,2020,2,"There is a unique positive real number $x$ such that the three numbers $\log_8(2x),\log_4x,$ and $\log_2x,$ in that order, form a geometric progression with positive common ratio. The number $x$ can be written as $\tfrac{m}{n},$ where $m$ and $n$ are relatively prime positive integers. Find $m+n.$",17,I
2020-I-3,2020,3,"A positive integer $N$ has base-eleven representation $\underline{a}\kern 0.1em\underline{b}\kern 0.1em\underline{c}$ and base-eight representation $\underline1\kern 0.1em\underline{b}\kern 0.1em\underline{c}\kern 0.1em\underline{a},$ where $a,b,$ and $c$ represent (not necessarily distinct) digits. Find the least such $N$ expressed in base ten.",621,I
2020-I-4,2020,4,"Let $S$ be the set of positive integers $N$ with the property that the last four digits of $N$ are $2020,$ and when the last four digits are removed, the result is a divisor of $N.$ For example, $42{,}020$ is in $S$ because $4$ is a divisor of $42{,}020.$ Find the sum of all the digits of all the numbers in $S.$ For example, the number $42{,}020$ contributes $4+2+0+2+0=8$ to this total.",93,I
2020-I-5,2020,5,Six cards numbered $1$ through $6$ are to be lined up in a row. Find the number of arrangements of these six cards where one of the cards can be removed leaving the remaining five cards in either ascending or descending order.,52,I
2020-I-6,2020,6,"A flat board has a circular hole with radius $1$ and a circular hole with radius $2$ such that the distance between the centers of the two holes is $7$ . Two spheres with equal radii sit in the two holes such that the spheres are tangent to each other. The square of the radius of the spheres is $\tfrac{m}{n}$ , where $m$ and $n$ are relatively prime positive integers. Find $m+n$ .",173,I
2020-I-7,2020,7,A club consisting of $11$ men and $12$ women needs to choose a committee from among its members so that the number of women on the committee is one more than the number of men on the committee. The committee could have as few as $1$ member or as many as $23$ members. Let $N$ be the number of such committees that can be formed. Find the sum of the prime numbers that divide $N.$,81,I
2020-I-8,2020,8,"A bug walks all day and sleeps all night. On the first day, it starts at point $O,$ faces east, and walks a distance of $5$ units due east. Each night the bug rotates $60^\circ$ counterclockwise. Each day it walks in this new direction half as far as it walked the previous day. The bug gets arbitrarily close to the point $P.$ Then $OP^2=\tfrac{m}{n},$ where $m$ and $n$ are relatively prime positive integers. Find $m+n.$",103,I
2020-I-9,2020,9,"Let $S$ be the set of positive integer divisors of $20^9.$ Three numbers are chosen independently and at random with replacement from the set $S$ and labeled $a_1,a_2,$ and $a_3$ in the order they are chosen. The probability that both $a_1$ divides $a_2$ and $a_2$ divides $a_3$ is $\tfrac{m}{n},$ where $m$ and $n$ are relatively prime positive integers. Find $m.$",77,I
2020-I-10,2020,10,"Let $m$ and $n$ be positive integers satisfying the conditions $\quad\bullet\ \gcd(m+n,210)=1,$ $\quad\bullet\ m^m$ is a multiple of $n^n,$ and $\quad\bullet\ m$ is not a multiple of $n.$ Find the least possible value of $m+n.$",407,I
2020-I-11,2020,11,"For integers $a,b,c$ and $d,$ let $f(x)=x^2+ax+b$ and $g(x)=x^2+cx+d.$ Find the number of ordered triples $(a,b,c)$ of integers with absolute values not exceeding $10$ for which there is an integer $d$ such that $g(f(2))=g(f(4))=0.$",510,I
2020-I-12,2020,12,Let $n$ be the least positive integer for which $149^n-2^n$ is divisible by $3^3\cdot5^5\cdot7^7.$ Find the number of positive integer divisors of $n.$,270,I
2020-I-13,2020,13,"Point $D$ lies on side $\overline{BC}$ of $\triangle ABC$ so that $\overline{AD}$ bisects $\angle BAC.$ The perpendicular bisector of $\overline{AD}$ intersects the bisectors of $\angle ABC$ and $\angle ACB$ in points $E$ and $F,$ respectively. Given that $AB=4,BC=5,$ and $CA=6,$ the area of $\triangle AEF$ can be written as $\tfrac{m\sqrt{n}}p,$ where $m$ and $p$ are relatively prime positive integers, and $n$ is a positive integer not divisible by the square of any prime. Find $m+n+p$ .",36,I
2020-I-14,2020,14,"Let $P(x)$ be a quadratic polynomial with complex coefficients whose $x^2$ coefficient is $1.$ Suppose the equation $P(P(x))=0$ has four distinct solutions, $x=3,4,a,b.$ Find the sum of all possible values of $(a+b)^2.$",85,I
2020-I-15,2020,15,"Let $\triangle ABC$ be an acute triangle with circumcircle $\omega,$ and let $H$ be the intersection of the altitudes of $\triangle ABC.$ Suppose the tangent to the circumcircle of $\triangle HBC$ at $H$ intersects $\omega$ at points $X$ and $Y$ with $HA=3,HX=2,$ and $HY=6.$ The area of $\triangle ABC$ can be written in the form $m\sqrt{n},$ where $m$ and $n$ are positive integers, and $n$ is not divisible by the square of any prime. Find $m+n.$",58,I
2020-II-1,2020,1,"Find the number of ordered pairs of positive integers $(m,n)$ such that ${m^2n = 20 ^{20}}$ .",231,II
2020-II-2,2020,2,"Let $P$ be a point chosen uniformly at random in the interior of the unit square with vertices at $(0,0), (1,0), (1,1)$ , and $(0,1)$ . The probability that the slope of the line determined by $P$ and the point $\left(\frac58, \frac38 \right)$ is greater than or equal to $\frac12$ can be written as $\frac{m}{n}$ , where $m$ and $n$ are relatively prime positive integers. Find $m+n$ .",171,II
2020-II-3,2020,3,"The value of $x$ that satisfies $\log_{2^x} 3^{20} = \log_{2^{x+3}} 3^{2020}$ can be written as $\frac{m}{n}$ , where $m$ and $n$ are relatively prime positive integers. Find $m+n$ .",103,II
2020-II-4,2020,4,"Triangles $\triangle ABC$ and $\triangle A'B'C'$ lie in the coordinate plane with vertices $A(0,0)$ , $B(0,12)$ , $C(16,0)$ , $A'(24,18)$ , $B'(36,18)$ , $C'(24,2)$ . A rotation of $m$ degrees clockwise around the point $(x,y)$ where $0<m<180$ , will transform $\triangle ABC$ to $\triangle A'B'C'$ . Find $m+x+y$ .",108,II
2020-II-5,2020,5,"For each positive integer $n$ , let $f(n)$ be the sum of the digits in the base-four representation of $n$ and let $g(n)$ be the sum of the digits in the base-eight representation of $f(n)$ . For example, $f(2020) = f(133210_{\text{4}}) = 10 = 12_{\text{8}}$ , and $g(2020) = \text{the digit sum of }12_{\text{8}} = 3$ . Let $N$ be the least value of $n$ such that the base-sixteen representation of $g(n)$ cannot be expressed using only the digits $0$ through $9$ . Find the remainder when $N$ is divided by $1000$ .",151,II
2020-II-6,2020,6,"Define a sequence recursively by $t_1 = 20$ , $t_2 = 21$ , and \[t_n = \frac{5t_{n-1}+1}{25t_{n-2}}\] for all $n \ge 3$ . Then $t_{2020}$ can be written as $\frac{p}{q}$ , where $p$ and $q$ are relatively prime positive integers. Find $p+q$ .",626,II
2020-II-7,2020,7,"Two congruent right circular cones each with base radius $3$ and height $8$ have axes of symmetry that intersect at right angles at a point in the interior of the cones a distance $3$ from the base of each cone. A sphere with radius $r$ lies within both cones. The maximum possible value of $r^2$ is $\frac{m}{n}$ , where $m$ and $n$ are relatively prime positive integers. Find $m+n$ .",298,II
2020-II-8,2020,8,"Define a sequence recursively by $f_1(x)=|x-1|$ and $f_n(x)=f_{n-1}(|x-n|)$ for integers $n>1$ . Find the least value of $n$ such that the sum of the zeros of $f_n$ exceeds $500,000$ .",101,II
2020-II-9,2020,9,"While watching a show, Ayako, Billy, Carlos, Dahlia, Ehuang, and Frank sat in that order in a row of six chairs. During the break, they went to the kitchen for a snack. When they came back, they sat on those six chairs in such a way that if two of them sat next to each other before the break, then they did not sit next to each other after the break. Find the number of possible seating orders they could have chosen after the break. ",90,II
2020-II-10,2020,10,"Find the sum of all positive integers $n$ such that when $1^3+2^3+3^3+\cdots +n^3$ is divided by $n+5$ , the remainder is $17$ .",239,II
2020-II-11,2020,11,"Let $P(x) = x^2 - 3x - 7$ , and let $Q(x)$ and $R(x)$ be two quadratic polynomials also with the coefficient of $x^2$ equal to $1$ . David computes each of the three sums $P + Q$ , $P + R$ , and $Q + R$ and is surprised to find that each pair of these sums has a common root, and these three common roots are distinct. If $Q(0) = 2$ , then $R(0) = \frac{m}{n}$ , where $m$ and $n$ are relatively prime positive integers. Find $m + n$ .",71,II
2020-II-12,2020,12,"Let $m$ and $n$ be odd integers greater than $1.$ An $m\times n$ rectangle is made up of unit squares where the squares in the top row are numbered left to right with the integers $1$ through $n$ , those in the second row are numbered left to right with the integers $n + 1$ through $2n$ , and so on. Square $200$ is in the top row, and square $2000$ is in the bottom row. Find the number of ordered pairs $(m,n)$ of odd integers greater than $1$ with the property that, in the $m\times n$ rectangle, the line through the centers of squares $200$ and $2000$ intersects the interior of square $1099$ .",248,II
2020-II-13,2020,13,"Convex pentagon $ABCDE$ has side lengths $AB=5$ , $BC=CD=DE=6$ , and $EA=7$ . Moreover, the pentagon has an inscribed circle (a circle tangent to each side of the pentagon). Find the area of $ABCDE$ .",60,II
2020-II-14,2020,14,"For real number $x$ let $\lfloor x\rfloor$ be the greatest integer less than or equal to $x$ , and define $\{x\} = x - \lfloor x \rfloor$ to be the fractional part of $x$ . For example, $\{3\} = 0$ and $\{4.56\} = 0.56$ . Define $f(x)=x\{x\}$ , and let $N$ be the number of real-valued solutions to the equation $f(f(f(x)))=17$ for $0\leq x\leq 2020$ . Find the remainder when $N$ is divided by $1000$ .",10,II
2020-II-15,2020,15,"Let $\triangle ABC$ be an acute scalene triangle with circumcircle $\omega$ . The tangents to $\omega$ at $B$ and $C$ intersect at $T$ . Let $X$ and $Y$ be the projections of $T$ onto lines $AB$ and $AC$ , respectively. Suppose $BT = CT = 16$ , $BC = 22$ , and $TX^2 + TY^2 + XY^2 = 1143$ . Find $XY^2$ .",717,II
2021-I-1,2021,1,"Zou and Chou are practicing their $100$ -meter sprints by running $6$ races against each other. Zou wins the first race, and after that, the probability that one of them wins a race is $\frac23$ if they won the previous race but only $\frac13$ if they lost the previous race. The probability that Zou will win exactly $5$ of the $6$ races is $\frac mn$ , where $m$ and $n$ are relatively prime positive integers. Find $m+n$ .",97,I
2021-I-2,2021,2,"In the diagram below, $ABCD$ is a rectangle with side lengths $AB=3$ and $BC=11$ , and $AECF$ is a rectangle with side lengths $AF=7$ and $FC=9,$ as shown. The area of the shaded region common to the interiors of both rectangles is $\frac mn$ , where $m$ and $n$ are relatively prime positive integers. Find $m+n$ . [asy] pair A, B, C, D, E, F; A = (0,3); B=(0,0); C=(11,0); D=(11,3); E=foot(C, A, (9/4,0)); F=foot(A, C, (35/4,3)); draw(A--B--C--D--cycle); draw(A--E--C--F--cycle); filldraw(A--(9/4,0)--C--(35/4,3)--cycle,gray*0.5+0.5*lightgray); dot(A^^B^^C^^D^^E^^F); label(""$A$"", A, W); label(""$B$"", B, W); label(""$C$"", C, (1,0)); label(""$D$"", D, (1,0)); label(""$F$"", F, N); label(""$E$"", E, S); [/asy]",109,I
2021-I-3,2021,3,Find the number of positive integers less than $1000$ that can be expressed as the difference of two integral powers of $2.$,50,I
2021-I-4,2021,4,Find the number of ways $66$ identical coins can be separated into three nonempty piles so that there are fewer coins in the first pile than in the second pile and fewer coins in the second pile than in the third pile.,331,I
2021-I-5,2021,5,Call a three-term strictly increasing arithmetic sequence of integers special if the sum of the squares of the three terms equals the product of the middle term and the square of the common difference. Find the sum of the third terms of all special sequences. ,31,I
2021-I-6,2021,6,"Segments $\overline{AB}, \overline{AC},$ and $\overline{AD}$ are edges of a cube and $\overline{AG}$ is a diagonal through the center of the cube. Point $P$ satisfies $BP=60\sqrt{10}$ , $CP=60\sqrt{5}$ , $DP=120\sqrt{2}$ , and $GP=36\sqrt{7}$ . Find $AP.$",192,I
2021-I-7,2021,7,"Find the number of pairs $(m,n)$ of positive integers with $1\le m<n\le 30$ such that there exists a real number $x$ satisfying \[\sin(mx)+\sin(nx)=2.\]",63,I
2021-I-8,2021,8,Find the number of integers $c$ such that the equation \[\left||20|x|-x^2|-c\right|=21\] has $12$ distinct real solutions.,57,I
2021-I-9,2021,9,"Let $ABCD$ be an isosceles trapezoid with $AD=BC$ and $AB<CD.$ Suppose that the distances from $A$ to the lines $BC,CD,$ and $BD$ are $15,18,$ and $10,$ respectively. Let $K$ be the area of $ABCD.$ Find $\sqrt2 \cdot K.$",567,I
2021-I-10,2021,10,"Consider the sequence $(a_k)_{k\ge 1}$ of positive rational numbers defined by $a_1 = \frac{2020}{2021}$ and for $k\ge 1$ , if $a_k = \frac{m}{n}$ for relatively prime positive integers $m$ and $n$ , then \[a_{k+1} = \frac{m + 18}{n+19}.\] Determine the sum of all positive integers $j$ such that the rational number $a_j$ can be written in the form $\frac{t}{t+1}$ for some positive integer $t$ .",59,I
2021-I-11,2021,11,"Let $ABCD$ be a cyclic quadrilateral with $AB=4,BC=5,CD=6,$ and $DA=7.$ Let $A_1$ and $C_1$ be the feet of the perpendiculars from $A$ and $C,$ respectively, to line $BD,$ and let $B_1$ and $D_1$ be the feet of the perpendiculars from $B$ and $D,$ respectively, to line $AC.$ The perimeter of $A_1B_1C_1D_1$ is $\frac mn,$ where $m$ and $n$ are relatively prime positive integers. Find $m+n.$",301,I
2021-I-12,2021,12,"Let $A_1A_2A_3\ldots A_{12}$ be a dodecagon ( $12$ -gon). Three frogs initially sit at $A_4,A_8,$ and $A_{12}$ . At the end of each minute, simultaneously, each of the three frogs jumps to one of the two vertices adjacent to its current position, chosen randomly and independently with both choices being equally likely. All three frogs stop jumping as soon as two frogs arrive at the same vertex at the same time. The expected number of minutes until the frogs stop jumping is $\frac mn$ , where $m$ and $n$ are relatively prime positive integers. Find $m+n$ .",19,I
2021-I-13,2021,13,"Circles $\omega_1$ and $\omega_2$ with radii $961$ and $625$ , respectively, intersect at distinct points $A$ and $B$ . A third circle $\omega$ is externally tangent to both $\omega_1$ and $\omega_2$ . Suppose line $AB$ intersects $\omega$ at two points $P$ and $Q$ such that the measure of minor arc $\widehat{PQ}$ is $120^{\circ}$ . Find the distance between the centers of $\omega_1$ and $\omega_2$ .",672,I
2021-I-14,2021,14,"For any positive integer $a,$ $\sigma(a)$ denotes the sum of the positive integer divisors of $a$ . Let $n$ be the least positive integer such that $\sigma(a^n)-1$ is divisible by $2021$ for all positive integers $a$ . Find the sum of the prime factors in the prime factorization of $n$ .",125,I
2021-I-15,2021,15,"Let $S$ be the set of positive integers $k$ such that the two parabolas \[y=x^2-k~~\text{and}~~x=2(y-20)^2-k\] intersect in four distinct points, and these four points lie on a circle with radius at most $21$ . Find the sum of the least element of $S$ and the greatest element of $S$ .",285,I
2021-II-1,2021,1,"Find the arithmetic mean of all the three-digit palindromes. (Recall that a palindrome is a number that reads the same forward and backward, such as $777$ or $383$ .)",550,II
2021-II-2,2021,2,"Equilateral triangle $ABC$ has side length $840$ . Point $D$ lies on the same side of line $BC$ as $A$ such that $\overline{BD} \perp \overline{BC}$ . The line $\ell$ through $D$ parallel to line $BC$ intersects sides $\overline{AB}$ and $\overline{AC}$ at points $E$ and $F$ , respectively. Point $G$ lies on $\ell$ such that $F$ is between $E$ and $G$ , $\triangle AFG$ is isosceles, and the ratio of the area of $\triangle AFG$ to the area of $\triangle BED$ is $8:9$ . Find $AF$ . [asy] pair A,B,C,D,E,F,G; B=origin; A=5*dir(60); C=(5,0); E=0.6*A+0.4*B; F=0.6*A+0.4*C; G=rotate(240,F)*A; D=extension(E,F,B,dir(90)); draw(D--G--A,grey); draw(B--0.5*A+rotate(60,B)*A*0.5,grey); draw(A--B--C--cycle,linewidth(1.5)); dot(A^^B^^C^^D^^E^^F^^G); label(""$A$"",A,dir(90)); label(""$B$"",B,dir(225)); label(""$C$"",C,dir(-45)); label(""$D$"",D,dir(180)); label(""$E$"",E,dir(-45)); label(""$F$"",F,dir(225)); label(""$G$"",G,dir(0)); label(""$\ell$"",midpoint(E--F),dir(90)); [/asy]",336,II
2021-II-3,2021,3,"Find the number of permutations $x_1, x_2, x_3, x_4, x_5$ of numbers $1, 2, 3, 4, 5$ such that the sum of five products \[x_1x_2x_3 + x_2x_3x_4 + x_3x_4x_5 + x_4x_5x_1 + x_5x_1x_2\] is divisible by $3$ .",80,II
2021-II-4,2021,4,"There are real numbers $a, b, c,$ and $d$ such that $-20$ is a root of $x^3 + ax + b$ and $-21$ is a root of $x^3 + cx^2 + d.$ These two polynomials share a complex root $m + \sqrt{n} \cdot i,$ where $m$ and $n$ are positive integers and $i = \sqrt{-1}.$ Find $m+n.$",330,II
2021-II-5,2021,5,"For positive real numbers $s$ , let $\tau(s)$ denote the set of all obtuse triangles that have area $s$ and two sides with lengths $4$ and $10$ . The set of all $s$ for which $\tau(s)$ is nonempty, but all triangles in $\tau(s)$ are congruent, is an interval $[a,b)$ . Find $a^2+b^2$ .",736,II
2021-II-6,2021,6,"For any finite set $S$ , let $|S|$ denote the number of elements in $S$ . Find the number of ordered pairs $(A,B)$ such that $A$ and $B$ are (not necessarily distinct) subsets of $\{1,2,3,4,5\}$ that satisfy \[|A| \cdot |B| = |A \cap B| \cdot |A \cup B|\]",454,II
2021-II-7,2021,7,"Let $a, b, c,$ and $d$ be real numbers that satisfy the system of equations \begin{align*} a + b &= -3, \\ ab + bc + ca &= -4, \\ abc + bcd + cda + dab &= 14, \\ abcd &= 30. \end{align*} There exist relatively prime positive integers $m$ and $n$ such that \[a^2 + b^2 + c^2 + d^2 = \frac{m}{n}.\] Find $m + n$ .",145,II
2021-II-8,2021,8,"An ant makes a sequence of moves on a cube where a move consists of walking from one vertex to an adjacent vertex along an edge of the cube. Initially the ant is at a vertex of the bottom face of the cube and chooses one of the three adjacent vertices to move to as its first move. For all moves after the first move, the ant does not return to its previous vertex, but chooses to move to one of the other two adjacent vertices. All choices are selected at random so that each of the possible moves is equally likely. The probability that after exactly $8$ moves that ant is at a vertex of the top face on the cube is $\frac{m}{n}$ , where $m$ and $n$ are relatively prime positive integers. Find $m + n.$",49,II
2021-II-9,2021,9,"Find the number of ordered pairs $(m, n)$ such that $m$ and $n$ are positive integers in the set $\{1, 2, ..., 30\}$ and the greatest common divisor of $2^m + 1$ and $2^n - 1$ is not $1$ .",295,II
2021-II-10,2021,10,"Two spheres with radii $36$ and one sphere with radius $13$ are each externally tangent to the other two spheres and to two different planes $\mathcal{P}$ and $\mathcal{Q}$ . The intersection of planes $\mathcal{P}$ and $\mathcal{Q}$ is the line $\ell$ . The distance from line $\ell$ to the point where the sphere with radius $13$ is tangent to plane $\mathcal{P}$ is $\tfrac{m}{n}$ , where $m$ and $n$ are relatively prime positive integers. Find $m + n$ .",335,II
2021-II-11,2021,11,"A teacher was leading a class of four perfectly logical students. The teacher chose a set $S$ of four integers and gave a different number in $S$ to each student. Then the teacher announced to the class that the numbers in $S$ were four consecutive two-digit positive integers, that some number in $S$ was divisible by $6$ , and a different number in $S$ was divisible by $7$ . The teacher then asked if any of the students could deduce what $S$ is, but in unison, all of the students replied no. However, upon hearing that all four students replied no, each student was able to determine the elements of $S$ . Find the sum of all possible values of the greatest element of $S$ .",258,II
2021-II-12,2021,12,"A convex quadrilateral has area $30$ and side lengths $5, 6, 9,$ and $7,$ in that order. Denote by $\theta$ the measure of the acute angle formed by the diagonals of the quadrilateral. Then $\tan \theta$ can be written in the form $\tfrac{m}{n}$ , where $m$ and $n$ are relatively prime positive integers. Find $m + n$ .",47,II
2021-II-13,2021,13,Find the least positive integer $n$ for which $2^n + 5^n - n$ is a multiple of $1000$ .,797,II
2021-II-14,2021,14,"Let $\Delta ABC$ be an acute triangle with circumcenter $O$ and centroid $G$ . Let $X$ be the intersection of the line tangent to the circumcircle of $\Delta ABC$ at $A$ and the line perpendicular to $GO$ at $G$ . Let $Y$ be the intersection of lines $XG$ and $BC$ . Given that the measures of $\angle ABC, \angle BCA,$ and $\angle XOY$ are in the ratio $13 : 2 : 17,$ the degree measure of $\angle BAC$ can be written as $\frac{m}{n},$ where $m$ and $n$ are relatively prime positive integers. Find $m+n$ .",592,II
2021-II-15,2021,15,Let $f(n)$ and $g(n)$ be functions satisfying \[f(n) =  \begin{cases} \sqrt{n} & \text{ if } \sqrt{n} \text{ is an integer}\\ 1 + f(n+1) & \text{ otherwise} \end{cases}\] and \[g(n) = \begin{cases}\sqrt{n} & \text{ if } \sqrt{n} \text{ is an integer}\\ 2 + g(n+2) & \text{ otherwise} \end{cases}\] for positive integers $n$ . Find the least positive integer $n$ such that $\tfrac{f(n)}{g(n)} = \tfrac{4}{7}$ .,258,II
2022-I-1,2022,1,"Quadratic polynomials $P(x)$ and $Q(x)$ have leading coefficients $2$ and $-2,$ respectively. The graphs of both polynomials pass through the two points $(16,54)$ and $(20,53).$ Find $P(0) + Q(0).$",116,I
2022-I-2,2022,2,"Find the three-digit positive integer $\underline{a}\,\underline{b}\,\underline{c}$ whose representation in base nine is $\underline{b}\,\underline{c}\,\underline{a}_{\,\text{nine}},$ where $a,$ $b,$ and $c$ are (not necessarily distinct) digits. ",227,I
2022-I-3,2022,3,"In isosceles trapezoid $ABCD,$ parallel bases $\overline{AB}$ and $\overline{CD}$ have lengths $500$ and $650,$ respectively, and $AD=BC=333.$ The angle bisectors of $\angle A$ and $\angle D$ meet at $P,$ and the angle bisectors of $\angle B$ and $\angle C$ meet at $Q.$ Find $PQ.$",242,I
2022-I-4,2022,4,"Let $w = \dfrac{\sqrt{3} + i}{2}$ and $z = \dfrac{-1 + i\sqrt{3}}{2},$ where $i = \sqrt{-1}.$ Find the number of ordered pairs $(r,s)$ of positive integers not exceeding $100$ that satisfy the equation $i \cdot w^r = z^s.$",834,I
2022-I-5,2022,5,"A straight river that is $264$ meters wide flows from west to east at a rate of $14$ meters per minute. Melanie and Sherry sit on the south bank of the river with Melanie a distance of $D$ meters downstream from Sherry. Relative to the water, Melanie swims at $80$ meters per minute, and Sherry swims at $60$ meters per minute. At the same time, Melanie and Sherry begin swimming in straight lines to a point on the north bank of the river that is equidistant from their starting positions. The two women arrive at this point simultaneously. Find $D.$",550,I
2022-I-6,2022,6,"Find the number of ordered pairs of integers $(a,b)$ such that the sequence \[3,4,5,a,b,30,40,50\] is strictly increasing and no set of four (not necessarily consecutive) terms forms an arithmetic progression.",228,I
2022-I-7,2022,7,"Let $a,b,c,d,e,f,g,h,i$ be distinct integers from $1$ to $9.$ The minimum possible positive value of \[\dfrac{a \cdot b \cdot c - d \cdot e \cdot f}{g \cdot h \cdot i}\] can be written as $\frac{m}{n},$ where $m$ and $n$ are relatively prime positive integers. Find $m+n.$",289,I
2022-I-8,2022,8,"Equilateral triangle $\triangle ABC$ is inscribed in circle $\omega$ with radius $18.$ Circle $\omega_A$ is tangent to sides $\overline{AB}$ and $\overline{AC}$ and is internally tangent to $\omega.$ Circles $\omega_B$ and $\omega_C$ are defined analogously. Circles $\omega_A,$ $\omega_B,$ and $\omega_C$ meet in six points---two points for each pair of circles. The three intersection points closest to the vertices of $\triangle ABC$ are the vertices of a large equilateral triangle in the interior of $\triangle ABC,$ and the other three intersection points are the vertices of a smaller equilateral triangle in the interior of $\triangle ABC.$ The side length of the smaller equilateral triangle can be written as $\sqrt{a} - \sqrt{b},$ where $a$ and $b$ are positive integers. Find $a+b.$",378,I
2022-I-9,2022,9,"Ellina has twelve blocks, two each of red ( $\textbf{R}$ ), blue ( $\textbf{B}$ ), yellow ( $\textbf{Y}$ ), green ( $\textbf{G}$ ), orange ( $\textbf{O}$ ), and purple ( $\textbf{P}$ ). Call an arrangement of blocks $\textit{even}$ if there is an even number of blocks between each pair of blocks of the same color. For example, the arrangement \[\textbf{R B B Y G G Y R O P P O}\] is even. Ellina arranges her blocks in a row in random order. The probability that her arrangement is even is $\frac{m}{n},$ where $m$ and $n$ are relatively prime positive integers. Find $m+n.$ ",247,I
2022-I-10,2022,10,"Three spheres with radii $11,$ $13,$ and $19$ are mutually externally tangent. A plane intersects the spheres in three congruent circles centered at $A,$ $B,$ and $C,$ respectively, and the centers of the spheres all lie on the same side of this plane. Suppose that $AB^2 = 560.$ Find $AC^2.$",756,I
